{
  "schemaVersion": "course1-technical-test-manifest-v1",
  "courseId": "course-1-controlled-ai-workflow-foundations",
  "graphPath": "audit_control/course1/technical_requirement_graph.json",
  "tests": [
    {"id":"C1-TST-DATA-001","type":"hybrid","owner":"Runner maintainer","environments":["fresh exact Python environment","native learner Windows"],"evidenceClass":"NATIVE_WINDOWS","procedures":[{"locator":"tools/accept_course1_cleanroom.py","selector":"protected_source_files_unchanged","command":"python tools/accept_course1_cleanroom.py","expected":"Synthetic confirmation, source preservation, inert prose, and formula-safe export all pass."},{"locator":"audit_control/course1/manual_test_procedures.md","selector":"## C1-TST-DATA-001","command":"Perform the named manual procedure.","expected":"The native evidence record covers every mapped DATA requirement."}],"currentEvidence":{"status":"UNVERIFIED","records":[]}},
    {"id":"C1-TST-FS-001","type":"manual","owner":"Runner security maintainer","environments":["native Windows 11 NTFS"],"evidenceClass":"NATIVE_WINDOWS","procedures":[{"locator":"audit_control/course1/manual_test_procedures.md","selector":"## C1-TST-FS-001","command":"Perform the named manual procedure.","expected":"Filesystem-identity containment passes and a seeded escape fails closed."}],"currentEvidence":{"status":"UNVERIFIED","records":[]}},
    {"id":"C1-TST-FS-002","type":"manual","owner":"Runner security maintainer","environments":["native Windows 11 NTFS"],"evidenceClass":"NATIVE_WINDOWS","procedures":[{"locator":"audit_control/course1/manual_test_procedures.md","selector":"## C1-TST-FS-002","command":"Perform the named manual procedure.","expected":"Every controlled path component rejects links, junctions, mounts, and reparse points."}],"currentEvidence":{"status":"UNVERIFIED","records":[]}},
    {"id":"C1-TST-FS-003","type":"manual","owner":"Runner security maintainer","environments":["native Windows 11 NTFS"],"evidenceClass":"NATIVE_WINDOWS","procedures":[{"locator":"audit_control/course1/manual_test_procedures.md","selector":"## C1-TST-FS-003","command":"Perform the named manual procedure.","expected":"File, directory, and special-file substitutions stop before mutation."}],"currentEvidence":{"status":"UNVERIFIED","records":[]}},
    {"id":"C1-TST-FS-004","type":"manual","owner":"Runner security maintainer","environments":["native Windows 11 NTFS","deterministic race harness"],"evidenceClass":"NATIVE_WINDOWS","procedures":[{"locator":"audit_control/course1/manual_test_procedures.md","selector":"## C1-TST-FS-004","command":"Perform the named manual procedure.","expected":"Every time-of-check/time-of-use swap is detected without redirected effect."}],"currentEvidence":{"status":"UNVERIFIED","records":[]}},
    {"id":"C1-TST-FS-005","type":"manual","owner":"Runner security maintainer","environments":["native Windows 11 NTFS"],"evidenceClass":"NATIVE_WINDOWS","procedures":[{"locator":"audit_control/course1/manual_test_procedures.md","selector":"## C1-TST-FS-005","command":"Perform the named manual procedure.","expected":"Only transaction-owned staging is cleaned and reparse targets remain untouched."}],"currentEvidence":{"status":"UNVERIFIED","records":[]}},
    {"id":"C1-TST-FS-006","type":"manual","owner":"Runner security maintainer","environments":["native Windows 11 NTFS"],"evidenceClass":"NATIVE_WINDOWS","procedures":[{"locator":"audit_control/course1/manual_test_procedures.md","selector":"## C1-TST-FS-006","command":"Perform the named manual procedure.","expected":"Rollback and incomplete-marker targets receive the same confinement checks."}],"currentEvidence":{"status":"UNVERIFIED","records":[]}},
    {"id":"C1-TST-FS-007","type":"manual","owner":"Runner security maintainer","environments":["native Windows 11 NTFS"],"evidenceClass":"NATIVE_WINDOWS","procedures":[{"locator":"audit_control/course1/manual_test_procedures.md","selector":"## C1-TST-FS-007","command":"Perform the named manual procedure.","expected":"The complete prohibited Windows path corpus stops before mutation."}],"currentEvidence":{"status":"UNVERIFIED","records":[]}},
    {"id":"C1-TST-FS-008","type":"manual","owner":"Runner security maintainer","environments":["native Windows 11 NTFS"],"evidenceClass":"NATIVE_WINDOWS","procedures":[{"locator":"audit_control/course1/manual_test_procedures.md","selector":"## C1-TST-FS-008","command":"Perform the named manual procedure.","expected":"All case-insensitive collisions are rejected consistently."}],"currentEvidence":{"status":"UNVERIFIED","records":[]}},
    {"id":"C1-TST-FS-009","type":"manual","owner":"Runner security maintainer","environments":["native Windows 11 NTFS"],"evidenceClass":"NATIVE_WINDOWS","procedures":[{"locator":"audit_control/course1/manual_test_procedures.md","selector":"## C1-TST-FS-009","command":"Perform the named manual procedure.","expected":"174 and 175 characters behave as specified and 176 stops before mutation."}],"currentEvidence":{"status":"UNVERIFIED","records":[]}},
    {"id":"C1-TST-FS-010","type":"hybrid","owner":"Runner maintainer","environments":["fresh exact Python environment","native Windows 11"],"evidenceClass":"NATIVE_WINDOWS","procedures":[{"locator":"course1_capstone/tests/test_workflow.py","selector":"test_all_missing_path_roles_are_sanitized_in_cli_evidence","command":"python -m unittest course1_capstone.tests.test_workflow.WorkflowTests.test_all_missing_path_roles_are_sanitized_in_cli_evidence","expected":"Known path-output cases contain only neutral locators."},{"locator":"audit_control/course1/manual_test_procedures.md","selector":"## C1-TST-FS-010","command":"Perform the named manual procedure.","expected":"Every portable output passes a full absolute-path and username scan."}],"currentEvidence":{"status":"UNVERIFIED","records":[]}},
    {"id":"C1-TST-FS-011","type":"manual","owner":"Runner security maintainer","environments":["native Windows 11 NTFS","multi-process harness"],"evidenceClass":"NATIVE_WINDOWS","procedures":[{"locator":"audit_control/course1/manual_test_procedures.md","selector":"## C1-TST-FS-011","command":"Perform the named manual procedure.","expected":"Live and unverified locks are preserved; only proved-stale locks follow recovery."}],"currentEvidence":{"status":"UNVERIFIED","records":[]}},
    {"id":"C1-TST-IO-001","type":"hybrid","owner":"Runner maintainer","environments":["fresh exact Python environment","property/fuzz maintainer environment"],"evidenceClass":"AUTOMATED_LOCAL","procedures":[{"locator":"course1_capstone/tests/test_workflow.py","selector":"test_runner_resource_limits_stop_before_materialising_oversized_input","command":"python -m unittest course1_capstone.tests.test_workflow.WorkflowTests.test_runner_resource_limits_stop_before_materialising_oversized_input","expected":"Known oversized inputs stop before materialisation."},{"locator":"audit_control/course1/manual_test_procedures.md","selector":"## C1-TST-IO-001","command":"Perform the named manual procedure.","expected":"Seeded property/fuzz limits and the persistent regression corpus pass."}],"currentEvidence":{"status":"UNVERIFIED","records":[]}},
    {"id":"C1-TST-IO-002","type":"manual","owner":"Runner maintainer","environments":["native Windows nl-NL","native Windows en-US"],"evidenceClass":"NATIVE_WINDOWS","procedures":[{"locator":"audit_control/course1/manual_test_procedures.md","selector":"## C1-TST-IO-002","command":"Perform the named manual procedure.","expected":"The full UTF-8, control, bidirectional, normalization, path, and locale corpus passes."}],"currentEvidence":{"status":"UNVERIFIED","records":[]}},
    {"id":"C1-TST-CAP-001","type":"hybrid","owner":"Runner security maintainer","environments":["native Windows denied-egress monitor"],"evidenceClass":"NATIVE_WINDOWS","procedures":[{"locator":"course1_capstone/tests/test_workflow.py","selector":"test_runtime_has_no_network_or_process_connector_import","command":"python -m unittest course1_capstone.tests.test_workflow.WorkflowTests.test_runtime_has_no_network_or_process_connector_import","expected":"The static forbidden-import gate passes."},{"locator":"audit_control/course1/manual_test_procedures.md","selector":"## C1-TST-CAP-001","command":"Perform the named manual procedure.","expected":"Operating-system observation proves denied network/DNS, immutable external-action control, and redacted output."}],"currentEvidence":{"status":"UNVERIFIED","records":[]}},
    {"id":"C1-TST-CAP-002","type":"manual","owner":"Runner security maintainer","environments":["native Windows process monitor"],"evidenceClass":"NATIVE_WINDOWS","procedures":[{"locator":"audit_control/course1/manual_test_procedures.md","selector":"## C1-TST-CAP-002","command":"Perform the named manual procedure.","expected":"Every child-process, shell, browser, executable, and dynamic-code attempt is denied and detected."}],"currentEvidence":{"status":"UNVERIFIED","records":[]}},
    {"id":"C1-TST-CAP-003","type":"manual","owner":"Runner security maintainer","environments":["fresh exact Python environment","runtime dependency monitor"],"evidenceClass":"NATIVE_WINDOWS","procedures":[{"locator":"audit_control/course1/manual_test_procedures.md","selector":"## C1-TST-CAP-003","command":"Perform the named manual procedure.","expected":"Provider, message, payment, ordering, connector, and write-back clients are absent at import and runtime."}],"currentEvidence":{"status":"UNVERIFIED","records":[]}},
    {"id":"C1-TST-CAP-005","type":"manual","owner":"Runner security maintainer","environments":["native Windows filesystem monitor"],"evidenceClass":"NATIVE_WINDOWS","procedures":[{"locator":"audit_control/course1/manual_test_procedures.md","selector":"## C1-TST-CAP-005","command":"Perform the named manual procedure.","expected":"Observed reads and writes exactly equal the allowlisted set."}],"currentEvidence":{"status":"UNVERIFIED","records":[]}},